{
  "schema_version": 1,
  "kind": "taxonomy_v1",
  "description": "十九赛事检索用工作分类。problem_types 是『工作分类』而非官方题型断言；method_tags/data_tags/domain_tags 分层，一题多标签、子问题独立标注。方法词表权威来源为 config/method_tags_v0.yaml，此处保留稳定 code/别名映射用于跨记录引用与校验。",
  "working_classification_note": "engine_regression_category 是回归分布用标签，不作为分类金标准。",
  "problem_types": [
    {
      "code": "optimization",
      "name_zh": "优化",
      "name_en": "optimization",
      "goal": "在约束下求目标函数最优（最大化/最小化），并给出决策方案",
      "boundary": "区分于单纯描述机理或预测；需有明确目标、决策变量与约束",
      "criteria": [
        "出现目标函数与约束条件",
        "要求求最优解或可行动作",
        "决策变量可枚举/连续"
      ]
    },
    {
      "code": "prediction",
      "name_zh": "预测",
      "name_en": "prediction",
      "goal": "用历史/观测数据对未来或未知量做推断",
      "boundary": "区分于机理推导；以数据驱动或时序外推为主",
      "criteria": [
        "有时间序列或样本数据",
        "要求给出未来值/区间/概率",
        "强调误差/不确定性"
      ]
    },
    {
      "code": "evaluation",
      "name_zh": "评价决策",
      "name_en": "evaluation",
      "goal": "对多个候选做排序/评分/择优或多个因素综合评判",
      "boundary": "区分于优化（通常无连续决策变量，以排序/权重为主）",
      "criteria": [
        "多指标打分/排序",
        "层次/权重/综合评分",
        "要求给出结论或排名"
      ]
    },
    {
      "code": "mechanism",
      "name_zh": "机理",
      "name_en": "mechanism",
      "goal": "建立描述物理/生物/传播等过程的方程或模型",
      "boundary": "区分于纯数据预测；需体现因果关系或守恒/动力学",
      "criteria": [
        "微分/差分方程或动力学过程",
        "因果关系或守恒律",
        "仿真/数值求解过程"
      ]
    },
    {
      "code": "classification",
      "name_zh": "分类识别",
      "name_en": "classification",
      "goal": "把对象归入若干已知类别并评估命中率",
      "boundary": "区分于评价（标签已知、以判别准确率为目标）",
      "criteria": [
        "有类别标签",
        "要求识别/判别",
        "混淆矩阵/准确率"
      ]
    },
    {
      "code": "statistical_analysis",
      "name_zh": "统计分析",
      "name_en": "statistical_analysis",
      "goal": "对数据进行描述、检验、相关性/差异分析",
      "boundary": "区分于机理与预测；以统计推断为核心产出",
      "criteria": [
        "假设检验/方差/相关",
        "分布/显著性结论",
        "不承诺预测未来"
      ]
    },
    {
      "code": "unknown",
      "name_zh": "待判定",
      "name_en": "unknown",
      "goal": null,
      "boundary": "尚不足以判定的工作类别",
      "criteria": []
    }
  ],
  "method_tag_dictionary_ref": "config/method_tags_v0.yaml",
  "method_tags": {
    "categories": [
      {
        "category_code": "optimization",
        "name_zh": "优化",
        "codes": [
          "linear_programming",
          "nonlinear_programming",
          "integer_programming",
          "binary_programming",
          "mixed_integer_programming",
          "multiobjective_optimization",
          "single_objective_optimization",
          "enumeration_search",
          "goal_programming",
          "dynamic_programming",
          "quadratic_programming",
          "convex_optimization",
          "simplex",
          "gradient_descent",
          "genetic_algorithm",
          "nsga_ii",
          "simulated_annealing",
          "particle_swarm",
          "ant_colony",
          "tabu_search",
          "differential_evolution",
          "immune_algorithm",
          "hungarian",
          "branch_bound",
          "greedy",
          "neighborhood_search",
          "reinforcement_learning",
          "lagrange_multiplier"
        ]
      },
      {
        "category_code": "graph",
        "name_zh": "图论与网络",
        "codes": [
          "graph_model",
          "complex_network",
          "shortest_path",
          "minimum_spanning_tree",
          "maximum_flow",
          "network_flow",
          "traveling_salesman",
          "assignment"
        ]
      },
      {
        "category_code": "evaluation",
        "name_zh": "评价/决策",
        "codes": [
          "ahp",
          "entropy_weight",
          "topsis",
          "fuzzy_evaluation",
          "grey_relation",
          "pca",
          "factor_analysis",
          "clustering",
          "discriminant_analysis",
          "dea",
          "rank_sum_ratio",
          "coefficient_variation",
          "spearman",
          "correlation",
          "sensitivity",
          "hypothesis_test",
          "anova"
        ]
      },
      {
        "category_code": "prediction",
        "name_zh": "预测",
        "codes": [
          "time_series",
          "grey_prediction",
          "regression",
          "linear_regression",
          "logistic_regression",
          "ridge_regression",
          "bayesian",
          "bp_network",
          "cnn",
          "rnn",
          "svm",
          "random_forest",
          "decision_tree",
          "knn",
          "xgboost",
          "adaboost",
          "deep_learning",
          "markov_chain",
          "kalman",
          "exponential_smoothing",
          "monte_carlo"
        ]
      },
      {
        "category_code": "mechanism",
        "name_zh": "机理/仿真",
        "codes": [
          "differential_equation",
          "difference_equation",
          "epidemic_model",
          "logistic_growth",
          "population_growth",
          "population_dynamics",
          "agent_based_model",
          "cellular_automata",
          "heat_equation",
          "wave_equation",
          "fluid_dynamics",
          "finite_element",
          "finite_difference",
          "runge_kutta",
          "queueing",
          "game_theory",
          "inventory_model",
          "stochastic_process",
          "system_dynamics",
          "projection_pursuit",
          "coupling_coordination",
          "neural_network",
          "discrete_event_simulation"
        ]
      },
      {
        "category_code": "data",
        "name_zh": "数据处理/数值",
        "codes": [
          "coordinate_transform",
          "geometry",
          "interpolation",
          "data_fitting",
          "least_squares",
          "fourier",
          "wavelet",
          "spectral_analysis"
        ]
      }
    ],
    "entries": [
      {
        "code": "linear_programming",
        "name_zh": "线性规划",
        "aliases": [
          "线性规划"
        ],
        "legacy_tag": "线性规划"
      },
      {
        "code": "nonlinear_programming",
        "name_zh": "非线性规划",
        "aliases": [
          "非线性规划"
        ],
        "legacy_tag": "非线性规划"
      },
      {
        "code": "integer_programming",
        "name_zh": "整数规划",
        "aliases": [
          "整数规划"
        ],
        "legacy_tag": "整数规划"
      },
      {
        "code": "binary_programming",
        "name_zh": "0-1规划",
        "aliases": [
          "0-1规划"
        ],
        "legacy_tag": "0-1规划"
      },
      {
        "code": "mixed_integer_programming",
        "name_zh": "混合整数规划",
        "aliases": [
          "混合整数规划"
        ],
        "legacy_tag": "混合整数规划"
      },
      {
        "code": "multiobjective_optimization",
        "name_zh": "多目标优化",
        "aliases": [
          "多目标优化"
        ],
        "legacy_tag": "多目标优化"
      },
      {
        "code": "single_objective_optimization",
        "name_zh": "单目标优化",
        "aliases": [
          "单目标优化"
        ],
        "legacy_tag": "单目标优化"
      },
      {
        "code": "enumeration_search",
        "name_zh": "枚举与搜索",
        "aliases": [
          "枚举与搜索"
        ],
        "legacy_tag": "枚举与搜索"
      },
      {
        "code": "goal_programming",
        "name_zh": "目标规划",
        "aliases": [
          "目标规划"
        ],
        "legacy_tag": "目标规划"
      },
      {
        "code": "dynamic_programming",
        "name_zh": "动态规划",
        "aliases": [
          "动态规划"
        ],
        "legacy_tag": "动态规划"
      },
      {
        "code": "quadratic_programming",
        "name_zh": "二次规划",
        "aliases": [
          "二次规划"
        ],
        "legacy_tag": "二次规划"
      },
      {
        "code": "convex_optimization",
        "name_zh": "凸优化",
        "aliases": [
          "凸优化"
        ],
        "legacy_tag": "凸优化"
      },
      {
        "code": "simplex",
        "name_zh": "单纯形法",
        "aliases": [
          "单纯形法"
        ],
        "legacy_tag": "单纯形法"
      },
      {
        "code": "gradient_descent",
        "name_zh": "梯度下降",
        "aliases": [
          "梯度下降"
        ],
        "legacy_tag": "梯度下降"
      },
      {
        "code": "genetic_algorithm",
        "name_zh": "遗传算法",
        "aliases": [
          "遗传算法"
        ],
        "legacy_tag": "遗传算法"
      },
      {
        "code": "nsga_ii",
        "name_zh": "NSGA-II",
        "aliases": [
          "NSGA-II"
        ],
        "legacy_tag": "NSGA-II"
      },
      {
        "code": "simulated_annealing",
        "name_zh": "模拟退火",
        "aliases": [
          "模拟退火"
        ],
        "legacy_tag": "模拟退火"
      },
      {
        "code": "particle_swarm",
        "name_zh": "粒子群算法",
        "aliases": [
          "粒子群算法"
        ],
        "legacy_tag": "粒子群算法"
      },
      {
        "code": "ant_colony",
        "name_zh": "蚁群算法",
        "aliases": [
          "蚁群算法"
        ],
        "legacy_tag": "蚁群算法"
      },
      {
        "code": "tabu_search",
        "name_zh": "禁忌搜索",
        "aliases": [
          "禁忌搜索"
        ],
        "legacy_tag": "禁忌搜索"
      },
      {
        "code": "differential_evolution",
        "name_zh": "差分进化",
        "aliases": [
          "差分进化"
        ],
        "legacy_tag": "差分进化"
      },
      {
        "code": "immune_algorithm",
        "name_zh": "免疫算法",
        "aliases": [
          "免疫算法"
        ],
        "legacy_tag": "免疫算法"
      },
      {
        "code": "hungarian",
        "name_zh": "匈牙利算法",
        "aliases": [
          "匈牙利算法"
        ],
        "legacy_tag": "匈牙利算法"
      },
      {
        "code": "branch_bound",
        "name_zh": "分支定界",
        "aliases": [
          "分支定界"
        ],
        "legacy_tag": "分支定界"
      },
      {
        "code": "greedy",
        "name_zh": "贪心算法",
        "aliases": [
          "贪心算法"
        ],
        "legacy_tag": "贪心算法"
      },
      {
        "code": "neighborhood_search",
        "name_zh": "邻域搜索",
        "aliases": [
          "邻域搜索"
        ],